{
  "$schema": "https://json-schema.org/draft/2020-12/schema",
  "$id": "https://narrative.dev/schemas/cp-chapters.schema.json",
  "title": "Control Plane Chapters Projection",
  "type": "object",
  "additionalProperties": false,
  "required": ["schema", "generatedAt", "sourceRevision", "chapters"],
  "properties": {
    "schema": {
      "const": "control-plane/chapters/v1"
    },
    "generatedAt": {
      "$ref": "#/$defs/isoTimestamp"
    },
    "sourceRevision": {
      "$ref": "#/$defs/sourceRevision"
    },
    "chapters": {
      "type": "array",
      "items": {
        "type": "object",
        "required": ["id", "title", "status"],
        "properties": {
          "id": { "type": "string" },
          "title": { "type": "string" },
          "wordCount": { "type": "integer", "minimum": 0 },
          "status": {
            "enum": ["pass", "warning", "blocked", "pending", "unknown"]
          },
          "docRef": { "type": "string" }
        },
        "additionalProperties": false
      }
    }
  },
  "$defs": {
    "isoTimestamp": {
      "type": "string",
      "format": "date-time"
    },
    "sourceRevision": {
      "type": "string",
      "minLength": 1
    }
  }
}
